{"created_at":"2026-09-04T16:00:00Z","identity":{"plan_id":"example-identity-offboarding-campaign","plan_sha256":"dbf36e323ebd25ceb44dd258aa0956efcb81cb3edb19950ccc1b48738c13d771"},"limitations":["plan_binds_every_active_declared_workload_to_reviewed_artifact_metadata_at_declared_nodes","spiffe_ids_are_identifiers_only_and_do_not_prove_svid_issuance_validation_or_possession","slsa_fields_are_a_bounded_projection_not_statement_signature_or_build-platform_verification","ai_bom_fields_are_a_bounded_projection_not_spdx_or_cyclonedx_document_validation","plan_validation_does_not_fetch_scan_load_import_execute_or_deserialize_artifact_bytes"],"nodes":[{"enforcement_point_id":"policy-gateway","node_id":"identity-policy-gateway"},{"enforcement_point_id":"credential-broker","node_id":"identity-credential-broker"}],"plan_id":"lureattest-artifact-conformance","policy":{"allowed_model_serializations":["onnx","safetensors"],"approved_builder_ids":["https://github.com/actions/runner"],"model_embedded_code_allowed":false,"provenance_required_for_roles":["container_image","model_weights","policy_bundle"],"remote_model_code_allowed":false,"required_artifact_roles":["ai_sbom","container_image","model_weights","policy_bundle"],"sbom_subject_roles":["container_image","model_weights","policy_bundle"]},"schema":"https://github.com/immu4989/lurebench/spec/lureartifact-plan-v1","schema_version":1,"standards":{"provenance_predicate_type":"https://slsa.dev/provenance/v1","statement_type":"https://in-toto.io/Statement/v1","supported_ai_bom_formats":["cyclonedx-1.6","cyclonedx-1.7","spdx-3.0.1"]},"system_id":"example-agent-system","workloads":[{"ai_bom":{"artifact_id":"alpha-ai-bom","document_sha256":"dddddddddddddddddddddddddddddddddddddddddddddddddddddddddddddddd","format":"spdx-3.0.1","subject_artifact_ids":["alpha-container","alpha-model","alpha-policy"]},"artifacts":[{"artifact_id":"alpha-ai-bom","media_type":"application/spdx+json","model_embedded_code":false,"model_serialization":null,"package_url":null,"remote_code_required":false,"role":"ai_sbom","sha256":"dddddddddddddddddddddddddddddddddddddddddddddddddddddddddddddddd"},{"artifact_id":"alpha-container","media_type":"application/vnd.oci.image.manifest.v1+json","model_embedded_code":false,"model_serialization":null,"package_url":"pkg:oci/example/lureagent-alpha@sha256:aaaaaaaaaaaaaaaaaaaaaaaaaaaaaaaaaaaaaaaaaaaaaaaaaaaaaaaaaaaaaaaa","remote_code_required":false,"role":"container_image","sha256":"aaaaaaaaaaaaaaaaaaaaaaaaaaaaaaaaaaaaaaaaaaaaaaaaaaaaaaaaaaaaaaaa"},{"artifact_id":"alpha-model","media_type":"application/vnd.safetensors","model_embedded_code":false,"model_serialization":"safetensors","package_url":"pkg:huggingface/example/model-alpha@0123456789abcdef","remote_code_required":false,"role":"model_weights","sha256":"bbbbbbbbbbbbbbbbbbbbbbbbbbbbbbbbbbbbbbbbbbbbbbbbbbbbbbbbbbbbbbbb"},{"artifact_id":"alpha-policy","media_type":"application/vnd.openpolicyagent.bundle","model_embedded_code":false,"model_serialization":null,"package_url":"pkg:generic/example/alpha-policy@1.0.0","remote_code_required":false,"role":"policy_bundle","sha256":"cccccccccccccccccccccccccccccccccccccccccccccccccccccccccccccccc"}],"attestations":[{"attestation_id":"alpha-container-provenance","build_type":"https://github.com/actions/runner/build/v1","builder_id":"https://github.com/actions/runner","predicate_type":"https://slsa.dev/provenance/v1","source_sha256":"1111111111111111111111111111111111111111111111111111111111111111","statement_sha256":"ec018cf4094eedc981d56d2d355a91fefe37bc979b40951c01caf66ce7df5513","statement_type":"https://in-toto.io/Statement/v1","subject_artifact_id":"alpha-container","subject_sha256":"aaaaaaaaaaaaaaaaaaaaaaaaaaaaaaaaaaaaaaaaaaaaaaaaaaaaaaaaaaaaaaaa"},{"attestation_id":"alpha-model-provenance","build_type":"https://github.com/actions/runner/build/v1","builder_id":"https://github.com/actions/runner","predicate_type":"https://slsa.dev/provenance/v1","source_sha256":"2222222222222222222222222222222222222222222222222222222222222222","statement_sha256":"1b60b4b0611d8ae804908621d18550c904095c02e5754bc7f721c047652a118b","statement_type":"https://in-toto.io/Statement/v1","subject_artifact_id":"alpha-model","subject_sha256":"bbbbbbbbbbbbbbbbbbbbbbbbbbbbbbbbbbbbbbbbbbbbbbbbbbbbbbbbbbbbbbbb"},{"attestation_id":"alpha-policy-provenance","build_type":"https://github.com/actions/runner/build/v1","builder_id":"https://github.com/actions/runner","predicate_type":"https://slsa.dev/provenance/v1","source_sha256":"3333333333333333333333333333333333333333333333333333333333333333","statement_sha256":"1d36e5d407714a423ab22dde372dfd7d15e0d20867230b63061016ad3d4abeca","statement_type":"https://in-toto.io/Statement/v1","subject_artifact_id":"alpha-policy","subject_sha256":"cccccccccccccccccccccccccccccccccccccccccccccccccccccccccccccccc"}],"node_ids":["identity-credential-broker","identity-policy-gateway"],"spiffe_id":"spiffe://example.com/agents/alpha","workload_principal_id":"workload-alpha"}]}
